{
    "version": 1,
    "instituicao": "[confirmar instituição]",
    "sistema": "[confirmar sistema de diário]",
    "manual": "[confirmar manual oficial]",
    "manualVersao": "[confirmar versão do manual]",
    "revisadoEm": "[confirmar data da revisão]",
    "campos": [
        {
            "id": "configuracao",
            "rotulo": "Rubrica, critérios, escala e preferências de feedback aprovados",
            "grupo": "configuracao",
            "obrigatorio": false,
            "limiteCaracteres": null,
            "instrucoes": "Registrar apenas configurações aprovadas pelo professor."
        },
        {
            "id": "evidencias",
            "rotulo": "Evidências e rastreabilidade (privado)",
            "grupo": "evidencia",
            "obrigatorio": false,
            "limiteCaracteres": null,
            "instrucoes": "Registrar somente evidências fornecidas, com fonte e data."
        },
        {
            "id": "atividades-chamada",
            "rotulo": "Atividades Desenvolvidas (Chamada)",
            "grupo": "diario",
            "obrigatorio": true,
            "limiteCaracteres": null,
            "instrucoes": "Descrever assunto, objetivo e condução efetiva da aula."
        },
        {
            "id": "feedback-individual",
            "rotulo": "Feedback Individual",
            "grupo": "diario",
            "obrigatorio": true,
            "limiteCaracteres": null,
            "instrucoes": "Usar formato aprovado e evidências observadas."
        },
        {
            "id": "atividades-indicadores",
            "rotulo": "Atividades Desenvolvidas (Notas/Indicadores)",
            "grupo": "diario",
            "obrigatorio": true,
            "limiteCaracteres": null,
            "instrucoes": "Relacionar atividade realizada, indicador oficial e evidência."
        },
        {
            "id": "observacao-docente",
            "rotulo": "Observação Docente",
            "grupo": "diario",
            "obrigatorio": true,
            "limiteCaracteres": null,
            "instrucoes": "Registrar fatos relevantes, sem juízos de caráter."
        },
        {
            "id": "recuperacao",
            "rotulo": "Ações de Recuperação",
            "grupo": "diario",
            "obrigatorio": true,
            "limiteCaracteres": null,
            "instrucoes": "Diferenciar proposta futura de ação realizada e desfecho confirmado."
        }
    ]
}
